{
  "schema_version": "1.0.0",
  "timestamp": "2026-05-25T01:32:06Z",
  "agent_role": "qe",
  "build_session_id": "alltheskills-p3-psfs-publish",
  "status": "PASS",
  "scores": {
    "correctness": {
      "score": 5,
      "notes": "lint-skills.sh skills/ exits 0 (0 errors, 111 non-blocking WARNs); --standard reports 'PSFS v1.0.0' + canonical schema path; bats tests/standard 12/12 pass; schema negative fixtures (bad semver, non-kebab name, '<' in description, bad min_plan) all correctly rejected; valid Core passes."
    },
    "completeness": {
      "score": 5,
      "notes": "All DoD artifacts present: spec/PSFS.md (v1.0.0 Published, both tiers normative w/ RFC-2119, field catalog, Reference Validators naming both validators, changelog), spec/frontmatter.schema.json (draft 2020-12), lint --standard binding, tests/standard, frontmatter-spec.md PSFS pointer."
    },
    "code_quality": {
      "score": 5,
      "notes": "bash -n scripts/lint-skills.sh clean; schema passes Draft202012Validator.check_schema; schema description documents per-file vs cross-file split; allowed-tools canonical with documented allowed_tools alias; additionalProperties:false at top-level and on owns without breaking the real tree."
    },
    "security": {
      "score": 5,
      "notes": "Angle-bracket prohibition (^[^<>]*$) present on 11 constrained string fields incl. description, name domain, compatibility, license, allowed-tools/allowed_tools items, argument-hint, owns.*, composes_with, spawned_by — preventing injection into the system prompt. '<' and '>' in description both rejected. No network/LLM/git in validators; jsonschema degrades to advisory when absent."
    },
    "contract_conformance": {
      "score": 5,
      "notes": "Matches contracts/standards/psfs.md QE gate exactly: lint gate not weakened (exit 0), --standard reports PSFS v1.0.0, all 47 real SKILL.md validate clean against schema (archive/ + in-progress/ excluded), tiers defined, both reference validators named, pointer present, schema and bash linter agree on the current tree (both green on identical set)."
    }
  },
  "test_results": {
    "unit": { "pass": 0, "fail": 0, "skip": 0 },
    "integration": { "pass": 12, "fail": 0, "skip": 0 },
    "e2e": { "pass": 0, "fail": 0, "skip": 0 },
    "contract": { "pass": 47, "fail": 0, "skip": 0 },
    "security_scan": { "pass": 11, "fail": 0, "skip": 0 }
  },
  "blockers": [],
  "issues": [
    {
      "id": "P3-I1",
      "severity": "INFO",
      "category": "lint_warnings",
      "file": null,
      "line": null,
      "description": "lint-skills.sh emits 111 WARNs on the real tree (long descriptions, missing optional allowed_tools/owns on some role skills, composes_with references to plugin-external skills like 'frontend-design', 'brainstorming', 'ui-ux-pro-max'). All are advisory; 0 errors. Pre-existing and unrelated to P3 schema/standard work; do not weaken any gate.",
      "suggested_fix": "No action required for P3 gate. Optionally tighten descriptions / add allowed_tools later; plugin-external composes_with refs are expected to resolve outside this repo."
    },
    {
      "id": "P3-I2",
      "severity": "INFO",
      "category": "test_taxonomy",
      "file": "coordination/p3-qa-report.json",
      "line": null,
      "description": "Test results mapped to the qa-report schema's fixed buckets: bats suite -> integration (12); per-file schema validation of every real SKILL.md -> contract (47); angle-bracket-prohibition string-field checks -> security_scan (11). No unit or e2e suites exist for this deliverable.",
      "suggested_fix": "None; mapping documented for orchestrator clarity."
    }
  ],
  "recommendations": [
    "Lead may wire spec/frontmatter.schema.json into CI (.github/workflows/lint-skills.yml) and bind PSFS v1.0.0 into contracts/installer/lint-rules.md per the contract's orchestrator section.",
    "When jsonschema is guaranteed in CI, the lint-skills.sh optional schema cross-check upgrades structural defects to ERRORs end-to-end; document the install requirement in CI."
  ],
  "gate_decision": {
    "proceed": true,
    "reason": "All QE gate criteria from contracts/standards/psfs.md satisfied: lint gate not weakened (scripts/lint-skills.sh skills/ exit 0, 0 errors); scripts/lint-skills.sh --standard reports PSFS v1.0.0 + canonical schema; all 47 real SKILL.md validate clean against spec/frontmatter.schema.json via jsonschema 4.26.0 (0 failures); schema passes Draft202012Validator.check_schema and declares draft 2020-12; bats tests/standard 12/12 pass; bash -n clean; spec/PSFS.md published v1.0.0 with both tiers and both reference validators named; frontmatter-spec.md carries the PSFS pointer; schema and bash linter agree on the current tree. No CRITICAL/HIGH blockers."
  }
}
